{
  "country_code": "FR",
  "party_id": "IIM",
  "id": "IZP-MLH-150",
  "currency": "EUR",
  "tariff_alt_text": [
    {
      "language": "fr",
      "text": "0.55€/kWh puis 2€/5min post-charge. Tous kWh ou minute entamés sont dus."
    }
  ],
  "elements": [
    {
      "price_components": [
        { "type": "ENERGY", "price": 0.4583, "vat": 20.0, "step_size": 1000 },
        { "type": "PARKING_TIME", "price": 20.0, "vat": 20.0, "step_size": 300 }
      ]
    }
  ],
  "last_updated": "2026-06-18T00:00:00Z"
}
