{
  "country_code": "FR",
  "party_id": "SIG",
  "id": "SIGE-24KW",
  "currency": "EUR",
  "tariff_alt_text": [
    {
      "language": "fr",
      "text": "Borne rapide 24kW : 0,45€/kWh + 0€/min pendant 2h puis 0,2€/min. Toute énergie ou minute entamée est due."
    }
  ],
  "elements": [
    {
      "price_components": [
        { "type": "ENERGY", "price": 0.375, "vat": 20.0, "step_size": 1000 }
      ]
    },
    {
      "price_components": [
        { "type": "TIME", "price": 0, "vat": 20.0, "step_size": 60 }
      ],
      "restrictions": { "max_duration": 7200 }
    },
    {
      "price_components": [
        { "type": "TIME", "price": 9.999, "vat": 20.0, "step_size": 60 }
      ],
      "restrictions": { "min_duration": 7200 }
    }
  ],
  "last_updated": "2026-06-18T00:00:00Z"
}
