{
  "country_code": "FR",
  "party_id": "IXL",
  "id": "IZIVIA-24KW-LIMOGES",
  "currency": "EUR",
  "tariff_alt_text": [
    {
      "language": "fr",
      "text": "Entre 8h et 20h: 0.42€/kWh puis 4€/h post-charge. Tous kWh ou minute entamés sont dus.  Entre 20h et 8h: forfait de connexion de 5€ et à partir de 20kWh, supplément de 0.3€/kWh."
    }
  ],
  "elements": [
    {
      "price_components": [
        { "type": "FLAT", "price": 4.1667, "vat": 20.0, "step_size": 1 }
      ],
      "restrictions": { "start_time": "20:00", "end_time": "08:00" }
    },
    {
      "price_components": [
        { "type": "ENERGY", "price": 0.25, "vat": 20.0, "step_size": 1000 }
      ],
      "restrictions": { "start_time": "20:00", "end_time": "08:00", "min_kwh": 20 }
    },
    {
      "price_components": [
        { "type": "ENERGY", "price": 0.35, "vat": 20.0, "step_size": 1000 }
      ],
      "restrictions": { "start_time": "08:00", "end_time": "20:00" }
    },
    {
      "price_components": [
        { "type": "PARKING_TIME", "price": 3.333, "vat": 20.0, "step_size": 60 }
      ],
      "restrictions": { "start_time": "08:00", "end_time": "20:00" }
    }
  ],
  "last_updated": "2026-06-18T00:00:00Z"
}
