{
  "country_code": "FR",
  "party_id": "GLY",
  "id": "LYON-my24kW",
  "currency": "EUR",
  "tariff_alt_text": [
    {
      "language": "fr",
      "text": "Entre 8h et 20h : 6€ par heure. Facturation par minute effectivement branchée. Entre 20h et 8h : forfait de connexion de 6€ et, à partir de 20kWh, supplément de 0,38€ par kWh."
    }
  ],
  "elements": [
    {
      "price_components": [
        { "type": "FLAT", "price": 5.0, "vat": 20.0, "step_size": 1 }
      ],
      "restrictions": { "start_time": "20:00", "end_time": "08:00" }
    },
    {
      "price_components": [
        { "type": "ENERGY", "price": 0.3167, "vat": 20.0, "step_size": 1000 }
      ],
      "restrictions": { "start_time": "20:00", "end_time": "08:00", "min_kwh": 20 }
    },
    {
      "price_components": [
        { "type": "TIME", "price": 4.998, "vat": 20.0, "step_size": 60 }
      ],
      "restrictions": { "start_time": "08:00", "end_time": "20:00" }
    }
  ],
  "last_updated": "2026-06-18T00:00:00Z"
}
